{"completion_policy":{"allow_exact_symbolic_solver":true,"allow_sampling_for_primary_claim":false,"exact_enumeration_cap":128,"mode":"exact","phase1_sealed":true,"positive_claim_requires_sign_invariance":true,"route_degeneracy_rule":{"classes":["NONDEGENERATE","R-ONLY_ROUTE","SINGLE_ACTION","NO_REPAIR_SPACE"],"classify_before_results":true,"permit_route_degenerate_measurement":true,"require_qualifier_for_positive_claim":true}},"config_hashes":{"completion_policy.yaml":"4b64ddfd25b53b2d30c8b06fac1faf4667c92e575c45566d4ffbc8d801eab660","controls.yaml":"445786900da8d2994f5ce91eb5bf5699a81aab20fda1682427c5e1dfb9777c92","costs.yaml":"57acd3b440f40212cfd8e76330951acdc8235f2f123aad3936d40d3776200137","experiment.yaml":"4d2afa3fdc81d9b92230961ebcf55f0db9caaefef32c5adeac1945445411f954"},"freeze_sets":[{"forbidden":[],"id":"F000"},{"forbidden":["E"],"id":"F100"},{"forbidden":["R"],"id":"F010"},{"forbidden":["A"],"id":"F001"},{"forbidden":["E","R"],"id":"F110"},{"forbidden":["E","A"],"id":"F101"},{"forbidden":["R","A"],"id":"F011"},{"forbidden":["E","R","A"],"id":"F111"}],"historical_change_id":"apache/polaris#4992","native_case_rule":{"allow_pc_generated_primary_cases":false,"description":"Include every upstream post-repair JUnit test method in the two changed OPA test files whose method body directly asserts equality on input.context.realm.","rule_id":"all_post_repair_test_methods_with_direct_context_realm_equality_assertion","selector":{"assertion_regex":"(?:get|path)\\(\"realm\"\\).*?isEqualTo\\(\"([^\"]+)\"\\)","files":["extensions/auth/opa/src/test/java/org/apache/polaris/extension/auth/opa/OpaPolarisAuthorizerFactoryTest.java","extensions/auth/opa/src/test/java/org/apache/polaris/extension/auth/opa/OpaPolarisAuthorizerTest.java"]}},"nonclaims":{"deployment_readiness":false,"prevalence":false,"superiority":false,"universal_zero_error":false},"positive_claim_rule":"Positive only if point identified or sign-positive for every admissible completion.","post_repair_ref":"d0a8dff401e30cab1df3ca6d0e133816e80e9c10","pre_repair_ref":"68cba2027e97683cfe62502cc2982c93e74e53e6","preregistration_hash":"e15968f42a911933de98b007ff6524de6a89141cda2f09f26cfcae1dae7896c1","primary_cost":{"id":"unit_intervention_cost","type":"unit","unit_cost":1},"primary_system_id":"apache_polaris_opa_pr4992","resource_question":"Compute K_Pi over all eight E/R/A freeze sets with Delta_R as the primary coordinate.","route_degeneracy_rule":{"classes":["NONDEGENERATE","R-ONLY_ROUTE","SINGLE_ACTION","NO_REPAIR_SPACE"],"classify_before_results":true,"permit_route_degenerate_measurement":true,"require_qualifier_for_positive_claim":true},"run_id":"external_v01_polaris_pr4992","sealed_before_phase2":true,"secondary_costs":[],"source_manifest_hash":"82498e35c2917fc0d0f3c489e7fddb89680a6eee1a3107e1c6d30ddc2c1d863e","stop_conditions":["SOURCE_HASH_MISMATCH","UNRESOLVED_TARGET","NATIVE_BEHAVIOR_NOT_REPLAYABLE","CONTRACT_REQUIRES_AUTHOR_INVENTION"]}
